{
  "spec_version": "0.4.0",
  "profile_id": "sia-minimal",
  "profile_version": "0.4.0",
  "catalog_version": "0.4.0",
  "catalog_sha256": "0f7c950f23c501258a7b21f8af5bcd58a0c7e4373592001918ed90615c655c0c",
  "node_id": "Interaction.Event.Alert.Collision.Warning",
  "node_schema_sha256": "cd8cbd4fccf056e8315c962eaad3c123178c445b6cf322d40b462475fdf1cc7c",
  "instance_id": "c8e1f4b2-7bd0-4c44-9a8e-0a9c7c2c4b21",
  "occurred_at_ms": 1784116800000,
  "valid_until_ms": 1784116800500,
  "target_role": "driver",
  "payload": {
    "time_to_collision_s": 1.4,
    "threat_bearing_deg": 12,
    "threat_range_m": 18,
    "relative_speed_kmh": 42
  },
  "attestation": {
    "actor_class": "adas",
    "actor_id": "ADAS_v2.3.1",
    "actor_registry_version": "0.4.0",
    "actor_registry_sha256": "6917bf5dbd4a06eeab25f4541207a2413420438c5977f831bbb1cbf870137413",
    "actor_credential_id": "11111111-1111-4111-8111-111111111111",
    "actor_credential_sha256": "a0cf9a2463d1a22c50e9eb916dfc96f26d607998ffe1cf8337d8548096362b1a",
    "key_id": "vehicle-hsm:adas:7",
    "algorithm": "ES256",
    "timestamp_ms": 1784116800000,
    "nonce": "cmFuZG9tLW5vbmNlLTE",
    "provenance_chain": [
      "ADAS_v2.3.1"
    ],
    "signature": "DD4XSr6CX8A6Kn7wEcBkT31XvqZbCdOub_neC1OiNJjXlV6uk3JYRlt_GkCBwRvUclo-OAHDp39GTIOWsuNzhQ"
  }
}
